{
  "name": "paired-on",
  "description": "产品评测：有万象术插件（配对 treatment）",
  "axis": "B",
  "room": "hosted-plugin-v1",
  "items": [
    "EVAL-B-PAIRED-TASK-ON",
    "EVAL-B-PAIRED-TASK-02-ON",
    "EVAL-B-PAIRED-TASK-03-ON",
    "EVAL-B-PAIRED-TASK-04-ON",
    "EVAL-B-PAIRED-TASK-05-ON",
    "EVAL-B-PAIRED-TASK-06-ON",
    "EVAL-B-PAIRED-TASK-07-ON",
    "EVAL-B-PAIRED-TASK-08-ON",
    "EVAL-B-PAIRED-TASK-09-ON",
    "EVAL-B-PAIRED-TASK-10-ON",
    "EVAL-B-PAIRED-TASK-11-ON",
    "EVAL-B-PAIRED-TASK-12-ON",
    "EVAL-B-PAIRED-TASK-13-ON",
    "EVAL-B-PAIRED-TASK-14-ON",
    "EVAL-B-PAIRED-TASK-15-ON",
    "EVAL-B-PAIRED-TASK-16-ON",
    "EVAL-B-PAIRED-TASK-17-ON",
    "EVAL-B-PAIRED-TASK-18-ON",
    "EVAL-B-PAIRED-TASK-19-ON",
    "EVAL-B-PAIRED-TASK-20-ON",
    "EVAL-B-PAIRED-TASK-21-ON",
    "EVAL-B-PAIRED-TASK-22-ON",
    "EVAL-B-PAIRED-TASK-23-ON",
    "EVAL-B-PAIRED-TASK-24-ON",
    "EVAL-B-PAIRED-TASK-25-ON",
    "EVAL-B-PAIRED-TASK-26-ON",
    "EVAL-B-PAIRED-TASK-27-ON",
    "EVAL-B-PAIRED-TASK-28-ON",
    "EVAL-B-PAIRED-TASK-29-ON",
    "EVAL-B-PAIRED-TASK-30-ON",
    "EVAL-B-PAIRED-TASK-31-ON",
    "EVAL-B-PAIRED-TASK-32-ON",
    "EVAL-B-PAIRED-TASK-33-ON",
    "EVAL-B-PAIRED-TASK-34-ON",
    "EVAL-B-PAIRED-TASK-35-ON",
    "EVAL-B-PAIRED-TASK-36-ON",
    "EVAL-B-PAIRED-TASK-37-ON",
    "EVAL-B-PAIRED-TASK-38-ON",
    "EVAL-B-PAIRED-TASK-39-ON",
    "EVAL-B-PAIRED-TASK-40-ON",
    "EVAL-B-PAIRED-TASK-41-ON",
    "EVAL-B-PAIRED-TASK-42-ON",
    "EVAL-B-PAIRED-TASK-43-ON",
    "EVAL-B-PAIRED-TASK-44-ON",
    "EVAL-B-PAIRED-TASK-45-ON",
    "EVAL-B-PAIRED-TASK-46-ON",
    "EVAL-B-PAIRED-TASK-47-ON",
    "EVAL-B-PAIRED-TASK-48-ON",
    "EVAL-B-PAIRED-TASK-49-ON",
    "EVAL-B-PAIRED-TASK-50-ON",
    "EVAL-B-PAIRED-TASK-51-ON",
    "EVAL-B-PAIRED-TASK-52-ON",
    "EVAL-B-PAIRED-TASK-53-ON",
    "EVAL-B-PAIRED-TASK-54-ON",
    "EVAL-B-PAIRED-TASK-55-ON",
    "EVAL-B-PAIRED-TASK-56-ON",
    "EVAL-B-PAIRED-TASK-57-ON",
    "EVAL-B-PAIRED-TASK-58-ON",
    "EVAL-B-PAIRED-TASK-59-ON",
    "EVAL-B-PAIRED-TASK-60-ON",
    "EVAL-B-PAIRED-TASK-61-ON",
    "EVAL-B-PAIRED-TASK-62-ON",
    "EVAL-B-PAIRED-TASK-63-ON",
    "EVAL-B-PAIRED-TASK-64-ON",
    "EVAL-B-PAIRED-TASK-65-ON",
    "EVAL-B-PAIRED-TASK-66-ON",
    "EVAL-B-PAIRED-TASK-67-ON",
    "EVAL-B-PAIRED-TASK-68-ON",
    "EVAL-B-PAIRED-TASK-69-ON",
    "EVAL-B-PAIRED-TASK-70-ON",
    "EVAL-B-PAIRED-TASK-71-ON",
    "EVAL-B-PAIRED-TASK-72-ON",
    "EVAL-B-PAIRED-TASK-73-ON",
    "EVAL-B-PAIRED-TASK-74-ON",
    "EVAL-B-PAIRED-TASK-75-ON",
    "EVAL-B-PAIRED-TASK-76-ON",
    "EVAL-B-PAIRED-TASK-77-ON",
    "EVAL-B-PAIRED-TASK-78-ON",
    "EVAL-B-PAIRED-TASK-79-ON",
    "EVAL-B-PAIRED-TASK-80-ON",
    "EVAL-B-PAIRED-TASK-81-ON",
    "EVAL-B-PAIRED-TASK-82-ON",
    "EVAL-B-PAIRED-TASK-83-ON",
    "EVAL-B-PAIRED-TASK-84-ON",
    "EVAL-B-PAIRED-TASK-85-ON",
    "EVAL-B-PAIRED-TASK-86-ON",
    "EVAL-B-PAIRED-TASK-87-ON",
    "EVAL-B-PAIRED-TASK-88-ON",
    "EVAL-B-PAIRED-TASK-89-ON",
    "EVAL-B-PAIRED-TASK-90-ON",
    "EVAL-B-PAIRED-TASK-91-ON",
    "EVAL-B-PAIRED-TASK-92-ON",
    "EVAL-B-PAIRED-TASK-93-ON",
    "EVAL-B-PAIRED-TASK-94-ON",
    "EVAL-B-PAIRED-TASK-95-ON",
    "EVAL-B-PAIRED-TASK-96-ON",
    "EVAL-B-PAIRED-TASK-97-ON",
    "EVAL-B-PAIRED-TASK-98-ON",
    "EVAL-B-PAIRED-TASK-99-ON",
    "EVAL-B-PAIRED-TASK-100-ON",
    "EVAL-B-PAIRED-TASK-101-ON",
    "EVAL-B-PAIRED-TASK-102-ON",
    "EVAL-B-PAIRED-TASK-103-ON",
    "EVAL-B-PAIRED-TASK-104-ON",
    "EVAL-B-PAIRED-TASK-105-ON",
    "EVAL-B-PAIRED-TASK-106-ON",
    "EVAL-B-PAIRED-TASK-107-ON",
    "EVAL-B-PAIRED-TASK-108-ON",
    "EVAL-B-PAIRED-TASK-109-ON",
    "EVAL-B-PAIRED-TASK-110-ON",
    "EVAL-B-PAIRED-TASK-111-ON",
    "EVAL-B-PAIRED-TASK-112-ON",
    "EVAL-B-PAIRED-TASK-113-ON",
    "EVAL-B-PAIRED-TASK-114-ON",
    "EVAL-B-PAIRED-TASK-115-ON",
    "EVAL-B-PAIRED-TASK-116-ON",
    "EVAL-B-PAIRED-TASK-117-ON",
    "EVAL-B-PAIRED-TASK-118-ON",
    "EVAL-B-PAIRED-TASK-119-ON",
    "EVAL-B-PAIRED-TASK-120-ON",
    "EVAL-B-PAIRED-TASK-121-ON",
    "EVAL-B-PAIRED-TASK-122-ON",
    "EVAL-B-PAIRED-TASK-123-ON",
    "EVAL-B-PAIRED-TASK-124-ON",
    "EVAL-B-PAIRED-TASK-125-ON",
    "EVAL-B-PAIRED-TASK-126-ON",
    "EVAL-B-PAIRED-TASK-127-ON",
    "EVAL-B-PAIRED-TASK-128-ON",
    "EVAL-B-PAIRED-TASK-129-ON",
    "EVAL-B-PAIRED-TASK-130-ON",
    "EVAL-B-PAIRED-TASK-131-ON",
    "EVAL-B-PAIRED-TASK-132-ON",
    "EVAL-B-PAIRED-TASK-133-ON",
    "EVAL-B-PAIRED-TASK-134-ON",
    "EVAL-B-PAIRED-TASK-135-ON",
    "EVAL-B-PAIRED-TASK-136-ON",
    "EVAL-B-PAIRED-TASK-137-ON",
    "EVAL-B-PAIRED-TASK-138-ON",
    "EVAL-B-PAIRED-TASK-139-ON",
    "EVAL-B-PAIRED-TASK-140-ON",
    "EVAL-B-PAIRED-TASK-141-ON",
    "EVAL-B-PAIRED-TASK-142-ON",
    "EVAL-B-PAIRED-TASK-143-ON",
    "EVAL-B-PAIRED-TASK-144-ON",
    "EVAL-B-PAIRED-TASK-145-ON",
    "EVAL-B-PAIRED-TASK-146-ON",
    "EVAL-B-PAIRED-TASK-147-ON",
    "EVAL-B-PAIRED-TASK-148-ON",
    "EVAL-B-PAIRED-TASK-149-ON",
    "EVAL-B-PAIRED-TASK-150-ON",
    "EVAL-B-PAIRED-TASK-151-ON",
    "EVAL-B-PAIRED-TASK-152-ON",
    "EVAL-B-PAIRED-TASK-153-ON",
    "EVAL-B-PAIRED-TASK-154-ON",
    "EVAL-B-PAIRED-TASK-155-ON",
    "EVAL-B-PAIRED-TASK-156-ON"
  ]
}
