{
  "name": "st-import-L1",
  "description": "ST-* 导入：≥10 条 L1 事件直测（Fold 面，非真宿主 e2e）",
  "axis": "A",
  "room": "fold-wanxiangshu-v1",
  "items": [
    "WX-A-ST-01-MAIN",
    "WX-A-ST-02-PARALLEL",
    "WX-A-ST-03-DEP-BLOCK",
    "WX-A-ST-03-DEP-READY",
    "WX-A-ST-04-FF-MERGE",
    "WX-A-ST-05-CONCURRENT",
    "WX-A-ST-07-EVENT-INTEGRITY",
    "WX-A-ST-08-REPLAY",
    "WX-A-ST-10-SLAVE-CRASH",
    "WX-A-ST-11-CANCEL",
    "WX-A-ST-13-CYCLE",
    "WX-A-ST-14-STRICT",
    "WX-A-ST-15-NUDGE"
  ],
  "gates": {
    "a_case_pass_rate": {
      "min": 1
    },
    "a_invariant_violations": {
      "max": 0
    }
  }
}
